{
  "$schema": "../schemas/market-data/minute-csv-import-request.schema.json",
  "content": "code,time,o,h,l,c,vol,amt\n600000.SH,2026-09-24 09:30,10,11,9,10.5,100,1050\n",
  "mapping": {"securityId": "code", "timestamp": "time", "open": "o", "high": "h", "low": "l", "close": "c", "volume": "vol", "amount": "amt"},
  "provenance": {"sourceName": "Synthetic contract fixture", "sourceReference": null, "licenseStatement": "Synthetic test data permitted for repository tests", "licenseVerification": "OPERATOR_CONFIRMED", "acquiredAt": "2026-09-24T01:35:00Z"},
  "market": "CN_A",
  "frequency": "1m",
  "adjustment": "RAW",
  "timezone": "Asia/Shanghai",
  "timestampSemantics": "BAR_START",
  "volumeUnit": "SHARES",
  "amountUnit": "CNY"
}
